  Flags: CHEERP_FLAGS='-O0'
  ✓ PASSED

  Flags: CHEERP_FLAGS='-O1'
  ✓ PASSED

  Flags: CHEERP_FLAGS='-O2'
  ✓ PASSED

  Flags: CHEERP_FLAGS='-O3'
  ✓ PASSED

  Flags: CHEERP_FLAGS='-O1 -cheerp-pretty-code'
  ✓ PASSED

  Flags: CHEERP_FLAGS='-O1 -cheerp-no-lto'
  ✗ FAILED
  Error details:
    Command Output (stderr):
    --
    RUN: at line 2: mkdir -p /home/alex/cheerp/cheerp-test/working_examples/strategy1_multi_test_loop/Output/array_of_structs.cpp.tmp
    + mkdir -p /home/alex/cheerp/cheerp-test/working_examples/strategy1_multi_test_loop/Output/array_of_structs.cpp.tmp
    RUN: at line 3: /home/alex/cheerp/cheerp-test/working_examples/strategy1_multi_test_loop/run_for_each_target.sh /home/alex/cheerp/cheerp-test/working_examples/strategy1_multi_test_loop/array_of_structs.cpp /home/alex/cheerp/cheerp-test/working_examples/strategy1_multi_test_loop/Output/array_of_structs.cpp.tmp 2>&1 | /usr/bin/FileCheck-20 /home/alex/cheerp/cheerp-test/working_examples/strategy1_multi_test_loop/array_of_structs.cpp
    + /home/alex/cheerp/cheerp-test/working_examples/strategy1_multi_test_loop/run_for_each_target.sh /home/alex/cheerp/cheerp-test/working_examples/strategy1_multi_test_loop/array_of_structs.cpp /home/alex/cheerp/cheerp-test/working_examples/strategy1_multi_test_loop/Output/array_of_structs.cpp.tmp
    + /usr/bin/FileCheck-20 /home/alex/cheerp/cheerp-test/working_examples/strategy1_multi_test_loop/array_of_structs.cpp
    
    --
    
    ********************
    ********************
    Failed Tests (1):
      Cheerp-Strategy1 :: array_of_structs.cpp
    
    
    Testing Time: 2.28s
    
    Total Discovered Tests: 1
      Failed: 1 (100.00%)

  Flags: CHEERP_FLAGS='-O3 -cheerp-no-lto'
  ✗ FAILED
  Error details:
    Command Output (stderr):
    --
    RUN: at line 2: mkdir -p /home/alex/cheerp/cheerp-test/working_examples/strategy1_multi_test_loop/Output/array_of_structs.cpp.tmp
    + mkdir -p /home/alex/cheerp/cheerp-test/working_examples/strategy1_multi_test_loop/Output/array_of_structs.cpp.tmp
    RUN: at line 3: /home/alex/cheerp/cheerp-test/working_examples/strategy1_multi_test_loop/run_for_each_target.sh /home/alex/cheerp/cheerp-test/working_examples/strategy1_multi_test_loop/array_of_structs.cpp /home/alex/cheerp/cheerp-test/working_examples/strategy1_multi_test_loop/Output/array_of_structs.cpp.tmp 2>&1 | /usr/bin/FileCheck-20 /home/alex/cheerp/cheerp-test/working_examples/strategy1_multi_test_loop/array_of_structs.cpp
    + /home/alex/cheerp/cheerp-test/working_examples/strategy1_multi_test_loop/run_for_each_target.sh /home/alex/cheerp/cheerp-test/working_examples/strategy1_multi_test_loop/array_of_structs.cpp /home/alex/cheerp/cheerp-test/working_examples/strategy1_multi_test_loop/Output/array_of_structs.cpp.tmp
    + /usr/bin/FileCheck-20 /home/alex/cheerp/cheerp-test/working_examples/strategy1_multi_test_loop/array_of_structs.cpp
    
    --
    
    ********************
    ********************
    Failed Tests (1):
      Cheerp-Strategy1 :: array_of_structs.cpp
    
    
    Testing Time: 2.27s
    
    Total Discovered Tests: 1
      Failed: 1 (100.00%)

  Flags: CHEERP_FLAGS='-O2 -cheerp-pretty-code'
  ✓ PASSED

  Flags: CHEERP_FLAGS='-O3 -cheerp-pretty-code'
  ✓ PASSED

  Flags: CHEERP_FLAGS='-O2 -cheerp-no-lto'
  ✗ FAILED
  Error details:
    Command Output (stderr):
    --
    RUN: at line 2: mkdir -p /home/alex/cheerp/cheerp-test/working_examples/strategy1_multi_test_loop/Output/array_of_structs.cpp.tmp
    + mkdir -p /home/alex/cheerp/cheerp-test/working_examples/strategy1_multi_test_loop/Output/array_of_structs.cpp.tmp
    RUN: at line 3: /home/alex/cheerp/cheerp-test/working_examples/strategy1_multi_test_loop/run_for_each_target.sh /home/alex/cheerp/cheerp-test/working_examples/strategy1_multi_test_loop/array_of_structs.cpp /home/alex/cheerp/cheerp-test/working_examples/strategy1_multi_test_loop/Output/array_of_structs.cpp.tmp 2>&1 | /usr/bin/FileCheck-20 /home/alex/cheerp/cheerp-test/working_examples/strategy1_multi_test_loop/array_of_structs.cpp
    + /home/alex/cheerp/cheerp-test/working_examples/strategy1_multi_test_loop/run_for_each_target.sh /home/alex/cheerp/cheerp-test/working_examples/strategy1_multi_test_loop/array_of_structs.cpp /home/alex/cheerp/cheerp-test/working_examples/strategy1_multi_test_loop/Output/array_of_structs.cpp.tmp
    + /usr/bin/FileCheck-20 /home/alex/cheerp/cheerp-test/working_examples/strategy1_multi_test_loop/array_of_structs.cpp
    
    --
    
    ********************
    ********************
    Failed Tests (1):
      Cheerp-Strategy1 :: array_of_structs.cpp
    
    
    Testing Time: 2.28s
    
    Total Discovered Tests: 1
      Failed: 1 (100.00%)

  Flags: CHEERP_FLAGS='-O3 -cheerp-no-lto'
  ✗ FAILED
  Error details:
    Command Output (stderr):
    --
    RUN: at line 2: mkdir -p /home/alex/cheerp/cheerp-test/working_examples/strategy1_multi_test_loop/Output/array_of_structs.cpp.tmp
    + mkdir -p /home/alex/cheerp/cheerp-test/working_examples/strategy1_multi_test_loop/Output/array_of_structs.cpp.tmp
    RUN: at line 3: /home/alex/cheerp/cheerp-test/working_examples/strategy1_multi_test_loop/run_for_each_target.sh /home/alex/cheerp/cheerp-test/working_examples/strategy1_multi_test_loop/array_of_structs.cpp /home/alex/cheerp/cheerp-test/working_examples/strategy1_multi_test_loop/Output/array_of_structs.cpp.tmp 2>&1 | /usr/bin/FileCheck-20 /home/alex/cheerp/cheerp-test/working_examples/strategy1_multi_test_loop/array_of_structs.cpp
    + /home/alex/cheerp/cheerp-test/working_examples/strategy1_multi_test_loop/run_for_each_target.sh /home/alex/cheerp/cheerp-test/working_examples/strategy1_multi_test_loop/array_of_structs.cpp /home/alex/cheerp/cheerp-test/working_examples/strategy1_multi_test_loop/Output/array_of_structs.cpp.tmp
    + /usr/bin/FileCheck-20 /home/alex/cheerp/cheerp-test/working_examples/strategy1_multi_test_loop/array_of_structs.cpp
    
    --
    
    ********************
    ********************
    Failed Tests (1):
      Cheerp-Strategy1 :: array_of_structs.cpp
    
    
    Testing Time: 2.28s
    
    Total Discovered Tests: 1
      Failed: 1 (100.00%)

  Flags: CHEERP_FLAGS='-O1 -fexceptions'
  ✓ PASSED

  Flags: CHEERP_FLAGS='-O1 -std=c++20'
  ✓ PASSED

  Flags: CHEERP_FLAGS='-O3 -cheerp-pretty-code -cheerp-no-lto'
  ✗ FAILED
  Error details:
    Command Output (stderr):
    --
    RUN: at line 2: mkdir -p /home/alex/cheerp/cheerp-test/working_examples/strategy1_multi_test_loop/Output/array_of_structs.cpp.tmp
    + mkdir -p /home/alex/cheerp/cheerp-test/working_examples/strategy1_multi_test_loop/Output/array_of_structs.cpp.tmp
    RUN: at line 3: /home/alex/cheerp/cheerp-test/working_examples/strategy1_multi_test_loop/run_for_each_target.sh /home/alex/cheerp/cheerp-test/working_examples/strategy1_multi_test_loop/array_of_structs.cpp /home/alex/cheerp/cheerp-test/working_examples/strategy1_multi_test_loop/Output/array_of_structs.cpp.tmp 2>&1 | /usr/bin/FileCheck-20 /home/alex/cheerp/cheerp-test/working_examples/strategy1_multi_test_loop/array_of_structs.cpp
    + /home/alex/cheerp/cheerp-test/working_examples/strategy1_multi_test_loop/run_for_each_target.sh /home/alex/cheerp/cheerp-test/working_examples/strategy1_multi_test_loop/array_of_structs.cpp /home/alex/cheerp/cheerp-test/working_examples/strategy1_multi_test_loop/Output/array_of_structs.cpp.tmp
    + /usr/bin/FileCheck-20 /home/alex/cheerp/cheerp-test/working_examples/strategy1_multi_test_loop/array_of_structs.cpp
    
    --
    
    ********************
    ********************
    Failed Tests (1):
      Cheerp-Strategy1 :: array_of_structs.cpp
    
    
    Testing Time: 2.33s
    
    Total Discovered Tests: 1
      Failed: 1 (100.00%)

  Flags: CHEERP_FLAGS='-O2 -cheerp-pretty-code -fexceptions'
  ✓ PASSED

  Flags: CHEERP_FLAGS='-O1 -cheerp-use-bigints'
  ✓ PASSED

  Flags: CHEERP_FLAGS='-O1 -pthread'
  ✗ FAILED
  Error details:
    <<<<<<
               1: === Testing target: js === 
    check:4'0     X~~~~~~~~~~~~~~~~~~~~~~~~~~ error: no match found
    check:4'1      ?                          possible intended match
               2: clang-16: error: invalid argument '-pthread' not allowed with '-target cheerp-genericjs' 
    check:4'0     ~~~~~~~~~~~~~~~~~~~~~~~~~~~~~~~~~~~~~~~~~~~~~~~~~~~~~~~~~~~~~~~~~~~~~~~~~~~~~~~~~~~~~~~~~
    >>>>>>
    
    --
    
    ********************
    ********************
    Failed Tests (1):
      Cheerp-Strategy1 :: array_of_structs.cpp
    
    
    Testing Time: 0.02s
    
    Total Discovered Tests: 1
      Failed: 1 (100.00%)




Cheerp Compilation Flags Test Summary
======================================
Timestamp: Mon Nov 10 06:07:53 PM CET 2025
Strategy: strategy1_multi_test_loop
Test files: array_of_structs.cpp

Results:
--------
Total tests:  17
Passed:       11
Failed:       6
Success rate: 64.7%

Flag combinations tested:
o0
o1
o2
o3
o1 pretty
o1 no_lto
o3 no_lto
o2 pretty
o3 pretty
o2 no_lto
o3 no_lto
o1 exceptions
o1 cpp20
o3 pretty no_lto
o2 pretty exceptions
o1 bigints
o1 pthread
  Flags: CHEERP_FLAGS='-O0'
  ✓ PASSED

  Flags: CHEERP_FLAGS='-O1'
  ✓ PASSED

  Flags: CHEERP_FLAGS='-O2'
  ✓ PASSED

  Flags: CHEERP_FLAGS='-O3'
  ✓ PASSED

  Flags: CHEERP_FLAGS='-O1 -cheerp-pretty-code'
  ✓ PASSED

  Flags: CHEERP_FLAGS='-O1 -cheerp-no-lto'
  ✗ FAILED
  Error details:
    Command Output (stderr):
    --
    RUN: at line 2: mkdir -p /home/alex/cheerp/cheerp-test/working_examples/strategy1_multi_test_loop/Output/array_of_structs.cpp.tmp
    + mkdir -p /home/alex/cheerp/cheerp-test/working_examples/strategy1_multi_test_loop/Output/array_of_structs.cpp.tmp
    RUN: at line 3: /home/alex/cheerp/cheerp-test/working_examples/strategy1_multi_test_loop/run_for_each_target.sh /home/alex/cheerp/cheerp-test/working_examples/strategy1_multi_test_loop/array_of_structs.cpp /home/alex/cheerp/cheerp-test/working_examples/strategy1_multi_test_loop/Output/array_of_structs.cpp.tmp 2>&1 | /usr/bin/FileCheck-20 /home/alex/cheerp/cheerp-test/working_examples/strategy1_multi_test_loop/array_of_structs.cpp
    + /home/alex/cheerp/cheerp-test/working_examples/strategy1_multi_test_loop/run_for_each_target.sh /home/alex/cheerp/cheerp-test/working_examples/strategy1_multi_test_loop/array_of_structs.cpp /home/alex/cheerp/cheerp-test/working_examples/strategy1_multi_test_loop/Output/array_of_structs.cpp.tmp
    + /usr/bin/FileCheck-20 /home/alex/cheerp/cheerp-test/working_examples/strategy1_multi_test_loop/array_of_structs.cpp
    
    --
    
    ********************
    ********************
    Failed Tests (1):
      Cheerp-Strategy1 :: array_of_structs.cpp
    
    
    Testing Time: 2.29s
    
    Total Discovered Tests: 1
      Failed: 1 (100.00%)

  Flags: CHEERP_FLAGS='-O3 -cheerp-no-lto'
  ✗ FAILED
  Error details:
    Command Output (stderr):
    --
    RUN: at line 2: mkdir -p /home/alex/cheerp/cheerp-test/working_examples/strategy1_multi_test_loop/Output/array_of_structs.cpp.tmp
    + mkdir -p /home/alex/cheerp/cheerp-test/working_examples/strategy1_multi_test_loop/Output/array_of_structs.cpp.tmp
    RUN: at line 3: /home/alex/cheerp/cheerp-test/working_examples/strategy1_multi_test_loop/run_for_each_target.sh /home/alex/cheerp/cheerp-test/working_examples/strategy1_multi_test_loop/array_of_structs.cpp /home/alex/cheerp/cheerp-test/working_examples/strategy1_multi_test_loop/Output/array_of_structs.cpp.tmp 2>&1 | /usr/bin/FileCheck-20 /home/alex/cheerp/cheerp-test/working_examples/strategy1_multi_test_loop/array_of_structs.cpp
    + /home/alex/cheerp/cheerp-test/working_examples/strategy1_multi_test_loop/run_for_each_target.sh /home/alex/cheerp/cheerp-test/working_examples/strategy1_multi_test_loop/array_of_structs.cpp /home/alex/cheerp/cheerp-test/working_examples/strategy1_multi_test_loop/Output/array_of_structs.cpp.tmp
    + /usr/bin/FileCheck-20 /home/alex/cheerp/cheerp-test/working_examples/strategy1_multi_test_loop/array_of_structs.cpp
    
    --
    
    ********************
    ********************
    Failed Tests (1):
      Cheerp-Strategy1 :: array_of_structs.cpp
    
    
    Testing Time: 2.23s
    
    Total Discovered Tests: 1
      Failed: 1 (100.00%)

  Flags: CHEERP_FLAGS='-O2 -cheerp-pretty-code'
  ✓ PASSED

  Flags: CHEERP_FLAGS='-O3 -cheerp-pretty-code'
  ✓ PASSED

  Flags: CHEERP_FLAGS='-O2 -cheerp-no-lto'
  ✗ FAILED
  Error details:
    Command Output (stderr):
    --
    RUN: at line 2: mkdir -p /home/alex/cheerp/cheerp-test/working_examples/strategy1_multi_test_loop/Output/array_of_structs.cpp.tmp
    + mkdir -p /home/alex/cheerp/cheerp-test/working_examples/strategy1_multi_test_loop/Output/array_of_structs.cpp.tmp
    RUN: at line 3: /home/alex/cheerp/cheerp-test/working_examples/strategy1_multi_test_loop/run_for_each_target.sh /home/alex/cheerp/cheerp-test/working_examples/strategy1_multi_test_loop/array_of_structs.cpp /home/alex/cheerp/cheerp-test/working_examples/strategy1_multi_test_loop/Output/array_of_structs.cpp.tmp 2>&1 | /usr/bin/FileCheck-20 /home/alex/cheerp/cheerp-test/working_examples/strategy1_multi_test_loop/array_of_structs.cpp
    + /home/alex/cheerp/cheerp-test/working_examples/strategy1_multi_test_loop/run_for_each_target.sh /home/alex/cheerp/cheerp-test/working_examples/strategy1_multi_test_loop/array_of_structs.cpp /home/alex/cheerp/cheerp-test/working_examples/strategy1_multi_test_loop/Output/array_of_structs.cpp.tmp
    + /usr/bin/FileCheck-20 /home/alex/cheerp/cheerp-test/working_examples/strategy1_multi_test_loop/array_of_structs.cpp
    
    --
    
    ********************
    ********************
    Failed Tests (1):
      Cheerp-Strategy1 :: array_of_structs.cpp
    
    
    Testing Time: 2.58s
    
    Total Discovered Tests: 1
      Failed: 1 (100.00%)

  Flags: CHEERP_FLAGS='-O3 -cheerp-no-lto'
  ✗ FAILED
  Error details:
    Command Output (stderr):
    --
    RUN: at line 2: mkdir -p /home/alex/cheerp/cheerp-test/working_examples/strategy1_multi_test_loop/Output/array_of_structs.cpp.tmp
    + mkdir -p /home/alex/cheerp/cheerp-test/working_examples/strategy1_multi_test_loop/Output/array_of_structs.cpp.tmp
    RUN: at line 3: /home/alex/cheerp/cheerp-test/working_examples/strategy1_multi_test_loop/run_for_each_target.sh /home/alex/cheerp/cheerp-test/working_examples/strategy1_multi_test_loop/array_of_structs.cpp /home/alex/cheerp/cheerp-test/working_examples/strategy1_multi_test_loop/Output/array_of_structs.cpp.tmp 2>&1 | /usr/bin/FileCheck-20 /home/alex/cheerp/cheerp-test/working_examples/strategy1_multi_test_loop/array_of_structs.cpp
    + /home/alex/cheerp/cheerp-test/working_examples/strategy1_multi_test_loop/run_for_each_target.sh /home/alex/cheerp/cheerp-test/working_examples/strategy1_multi_test_loop/array_of_structs.cpp /home/alex/cheerp/cheerp-test/working_examples/strategy1_multi_test_loop/Output/array_of_structs.cpp.tmp
    + /usr/bin/FileCheck-20 /home/alex/cheerp/cheerp-test/working_examples/strategy1_multi_test_loop/array_of_structs.cpp
    
    --
    
    ********************
    ********************
    Failed Tests (1):
      Cheerp-Strategy1 :: array_of_structs.cpp
    
    
    Testing Time: 2.50s
    
    Total Discovered Tests: 1
      Failed: 1 (100.00%)

  Flags: CHEERP_FLAGS='-O1 -fexceptions'
  ✓ PASSED

  Flags: CHEERP_FLAGS='-O1 -std=c++20'
  ✓ PASSED

  Flags: CHEERP_FLAGS='-O3 -cheerp-pretty-code -cheerp-no-lto'
  ✗ FAILED
  Error details:
    Command Output (stderr):
    --
    RUN: at line 2: mkdir -p /home/alex/cheerp/cheerp-test/working_examples/strategy1_multi_test_loop/Output/array_of_structs.cpp.tmp
    + mkdir -p /home/alex/cheerp/cheerp-test/working_examples/strategy1_multi_test_loop/Output/array_of_structs.cpp.tmp
    RUN: at line 3: /home/alex/cheerp/cheerp-test/working_examples/strategy1_multi_test_loop/run_for_each_target.sh /home/alex/cheerp/cheerp-test/working_examples/strategy1_multi_test_loop/array_of_structs.cpp /home/alex/cheerp/cheerp-test/working_examples/strategy1_multi_test_loop/Output/array_of_structs.cpp.tmp 2>&1 | /usr/bin/FileCheck-20 /home/alex/cheerp/cheerp-test/working_examples/strategy1_multi_test_loop/array_of_structs.cpp
    + /home/alex/cheerp/cheerp-test/working_examples/strategy1_multi_test_loop/run_for_each_target.sh /home/alex/cheerp/cheerp-test/working_examples/strategy1_multi_test_loop/array_of_structs.cpp /home/alex/cheerp/cheerp-test/working_examples/strategy1_multi_test_loop/Output/array_of_structs.cpp.tmp
    + /usr/bin/FileCheck-20 /home/alex/cheerp/cheerp-test/working_examples/strategy1_multi_test_loop/array_of_structs.cpp
    
    --
    
    ********************
    ********************
    Failed Tests (1):
      Cheerp-Strategy1 :: array_of_structs.cpp
    
    
    Testing Time: 2.30s
    
    Total Discovered Tests: 1
      Failed: 1 (100.00%)

  Flags: CHEERP_FLAGS='-O2 -cheerp-pretty-code -fexceptions'
  ✓ PASSED

  Flags: CHEERP_FLAGS='-O1 -cheerp-use-bigints'
  ✓ PASSED

  Flags: CHEERP_FLAGS='-O1 -pthread'
  ✗ FAILED
  Error details:
    <<<<<<
               1: === Testing target: js === 
    check:4'0     X~~~~~~~~~~~~~~~~~~~~~~~~~~ error: no match found
    check:4'1      ?                          possible intended match
               2: clang-16: error: invalid argument '-pthread' not allowed with '-target cheerp-genericjs' 
    check:4'0     ~~~~~~~~~~~~~~~~~~~~~~~~~~~~~~~~~~~~~~~~~~~~~~~~~~~~~~~~~~~~~~~~~~~~~~~~~~~~~~~~~~~~~~~~~
    >>>>>>
    
    --
    
    ********************
    ********************
    Failed Tests (1):
      Cheerp-Strategy1 :: array_of_structs.cpp
    
    
    Testing Time: 0.02s
    
    Total Discovered Tests: 1
      Failed: 1 (100.00%)




Cheerp Compilation Flags Test Summary
======================================
Timestamp: Mon Nov 10 06:15:33 PM CET 2025
Strategy: strategy1_multi_test_loop
Test files: array_of_structs.cpp

Results:
--------
Total tests:  17
Passed:       11
Failed:       6
Success rate: 64.7%

Flag combinations tested:
o0
o1
o2
o3
o1 pretty
o1 no_lto
o3 no_lto
o2 pretty
o3 pretty
o2 no_lto
o3 no_lto
o1 exceptions
o1 cpp20
o3 pretty no_lto
o2 pretty exceptions
o1 bigints
o1 pthread
